{
  "$schema": "schema/ffi-schema.schema.json",
  "schemaVersion": 1,
  "namespace": "org.glavo.himari.platform.macos.generated",
  "library": "objc",
  "target": {
    "operatingSystem": "macos",
    "architecture": "x86_64",
    "byteOrder": "little_endian",
    "addressSize": 8,
    "addressAlignment": 8
  },
  "types": [
    { "kind": "primitive", "name": "void", "primitiveKind": "void", "byteSize": 0, "alignment": 1, "signedness": "none", "availability": { "introduced": null, "deprecated": null, "unavailable": false } },
    { "kind": "primitive", "name": "u8", "primitiveKind": "integer", "byteSize": 1, "alignment": 1, "signedness": "unsigned", "availability": { "introduced": null, "deprecated": null, "unavailable": false } },
    { "kind": "primitive", "name": "i8", "primitiveKind": "integer", "byteSize": 1, "alignment": 1, "signedness": "signed", "availability": { "introduced": null, "deprecated": null, "unavailable": false } },
    { "kind": "primitive", "name": "f64", "primitiveKind": "floating", "byteSize": 8, "alignment": 8, "signedness": "none", "availability": { "introduced": null, "deprecated": null, "unavailable": false } },
    { "kind": "primitive", "name": "u64", "primitiveKind": "integer", "byteSize": 8, "alignment": 8, "signedness": "unsigned", "availability": { "introduced": null, "deprecated": null, "unavailable": false } },
    { "kind": "pointer", "name": "void_ptr", "pointee": "void", "constant": false, "availability": { "introduced": null, "deprecated": null, "unavailable": false } },
    { "kind": "pointer", "name": "const_char_ptr", "pointee": "u8", "constant": true, "availability": { "introduced": null, "deprecated": null, "unavailable": false } },
    { "kind": "handle", "name": "objc_object", "representation": "void_ptr", "invalidValues": [0], "availability": { "introduced": null, "deprecated": null, "unavailable": false } },
    { "kind": "handle", "name": "objc_selector", "representation": "void_ptr", "invalidValues": [0], "availability": { "introduced": null, "deprecated": null, "unavailable": false } },
    {
      "kind": "aggregate",
      "name": "ns_rect",
      "aggregateKind": "struct",
      "byteSize": 32,
      "alignment": 8,
      "packing": 0,
      "fields": [
        { "name": "x", "type": "f64", "byteOffset": 0, "bitOffset": null, "bitWidth": null },
        { "name": "y", "type": "f64", "byteOffset": 8, "bitOffset": null, "bitWidth": null },
        { "name": "width", "type": "f64", "byteOffset": 16, "bitOffset": null, "bitWidth": null },
        { "name": "height", "type": "f64", "byteOffset": 24, "bitOffset": null, "bitWidth": null }
      ],
      "availability": { "introduced": null, "deprecated": null, "unavailable": false }
    }
  ],
  "callbacks": [],
  "functions": [
    {
      "name": "objcGetClass",
      "symbol": "objc_getClass",
      "result": { "type": "objc_object", "nullability": "nullable", "ownership": "borrowed" },
      "parameters": [
        { "name": "name", "type": "const_char_ptr", "direction": "in", "nullability": "non_null", "ownership": "borrowed" }
      ],
      "callingConvention": "system",
      "variadicFrom": null,
      "errorPolicy": "none",
      "threadRestriction": "any",
      "availability": { "introduced": null, "deprecated": null, "unavailable": false }
    },
    {
      "name": "selRegisterName",
      "symbol": "sel_registerName",
      "result": { "type": "objc_selector", "nullability": "non_null", "ownership": "borrowed" },
      "parameters": [
        { "name": "name", "type": "const_char_ptr", "direction": "in", "nullability": "non_null", "ownership": "borrowed" }
      ],
      "callingConvention": "system",
      "variadicFrom": null,
      "errorPolicy": "none",
      "threadRestriction": "any",
      "availability": { "introduced": null, "deprecated": null, "unavailable": false }
    },
    {
      "name": "objcMsgSendId",
      "symbol": "objc_msgSend",
      "result": { "type": "objc_object", "nullability": "nullable", "ownership": "owned" },
      "parameters": [
        { "name": "receiver", "type": "objc_object", "direction": "in", "nullability": "non_null", "ownership": "borrowed" },
        { "name": "selector", "type": "objc_selector", "direction": "in", "nullability": "non_null", "ownership": "borrowed" }
      ],
      "callingConvention": "system",
      "variadicFrom": null,
      "errorPolicy": "none",
      "threadRestriction": "any",
      "availability": { "introduced": null, "deprecated": null, "unavailable": false }
    },
    {
      "name": "objcMsgSendIdObject",
      "symbol": "objc_msgSend",
      "result": { "type": "objc_object", "nullability": "nullable", "ownership": "owned" },
      "parameters": [
        { "name": "receiver", "type": "objc_object", "direction": "in", "nullability": "non_null", "ownership": "borrowed" },
        { "name": "selector", "type": "objc_selector", "direction": "in", "nullability": "non_null", "ownership": "borrowed" },
        { "name": "object", "type": "objc_object", "direction": "in", "nullability": "nullable", "ownership": "borrowed" }
      ],
      "callingConvention": "system",
      "variadicFrom": null,
      "errorPolicy": "none",
      "threadRestriction": "any",
      "availability": { "introduced": null, "deprecated": null, "unavailable": false }
    },
    {
      "name": "objcMsgSendIdCString",
      "symbol": "objc_msgSend",
      "result": { "type": "objc_object", "nullability": "nullable", "ownership": "owned" },
      "parameters": [
        { "name": "receiver", "type": "objc_object", "direction": "in", "nullability": "non_null", "ownership": "borrowed" },
        { "name": "selector", "type": "objc_selector", "direction": "in", "nullability": "non_null", "ownership": "borrowed" },
        { "name": "utf8", "type": "const_char_ptr", "direction": "in", "nullability": "non_null", "ownership": "borrowed" }
      ],
      "callingConvention": "system",
      "variadicFrom": null,
      "errorPolicy": "none",
      "threadRestriction": "any",
      "availability": { "introduced": null, "deprecated": null, "unavailable": false }
    },
    {
      "name": "objcMsgSendVoid",
      "symbol": "objc_msgSend",
      "result": { "type": "void", "nullability": "unspecified", "ownership": "none" },
      "parameters": [
        { "name": "receiver", "type": "objc_object", "direction": "in", "nullability": "non_null", "ownership": "borrowed" },
        { "name": "selector", "type": "objc_selector", "direction": "in", "nullability": "non_null", "ownership": "borrowed" }
      ],
      "callingConvention": "system",
      "variadicFrom": null,
      "errorPolicy": "none",
      "threadRestriction": "any",
      "availability": { "introduced": null, "deprecated": null, "unavailable": false }
    },
    {
      "name": "objcMsgSendVoidObject",
      "symbol": "objc_msgSend",
      "result": { "type": "void", "nullability": "unspecified", "ownership": "none" },
      "parameters": [
        { "name": "receiver", "type": "objc_object", "direction": "in", "nullability": "non_null", "ownership": "borrowed" },
        { "name": "selector", "type": "objc_selector", "direction": "in", "nullability": "non_null", "ownership": "borrowed" },
        { "name": "object", "type": "objc_object", "direction": "in", "nullability": "nullable", "ownership": "borrowed" }
      ],
      "callingConvention": "system",
      "variadicFrom": null,
      "errorPolicy": "none",
      "threadRestriction": "any",
      "availability": { "introduced": null, "deprecated": null, "unavailable": false }
    },
    {
      "name": "objcMsgSendVoidBool",
      "symbol": "objc_msgSend",
      "result": { "type": "void", "nullability": "unspecified", "ownership": "none" },
      "parameters": [
        { "name": "receiver", "type": "objc_object", "direction": "in", "nullability": "non_null", "ownership": "borrowed" },
        { "name": "selector", "type": "objc_selector", "direction": "in", "nullability": "non_null", "ownership": "borrowed" },
        { "name": "value", "type": "i8", "direction": "in", "nullability": "unspecified", "ownership": "none" }
      ],
      "callingConvention": "system",
      "variadicFrom": null,
      "errorPolicy": "none",
      "threadRestriction": "any",
      "availability": { "introduced": null, "deprecated": null, "unavailable": false }
    },
    {
      "name": "objcMsgSendInitWindow",
      "symbol": "objc_msgSend",
      "result": { "type": "objc_object", "nullability": "nullable", "ownership": "owned" },
      "parameters": [
        { "name": "receiver", "type": "objc_object", "direction": "in", "nullability": "non_null", "ownership": "borrowed" },
        { "name": "selector", "type": "objc_selector", "direction": "in", "nullability": "non_null", "ownership": "borrowed" },
        { "name": "contentRect", "type": "ns_rect", "direction": "in", "nullability": "unspecified", "ownership": "none" },
        { "name": "styleMask", "type": "u64", "direction": "in", "nullability": "unspecified", "ownership": "none" },
        { "name": "backing", "type": "u64", "direction": "in", "nullability": "unspecified", "ownership": "none" },
        { "name": "defer", "type": "i8", "direction": "in", "nullability": "unspecified", "ownership": "none" }
      ],
      "callingConvention": "system",
      "variadicFrom": null,
      "errorPolicy": "none",
      "threadRestriction": "any",
      "availability": { "introduced": null, "deprecated": null, "unavailable": false }
    }
  ]
}
